{
	"$schema": "https://compatibility.nativescript.org/v1/schemas/verified.json",
	"package": "@nativescript/ios",
	"version": "9.0.2",
	"toolchains": {
		"xcode": "26.4",
		"cocoapods": "1.17.0"
	},
	"with": {
		"nativescript": "9.1.1",
		"node": "26"
	},
	"resolved": {
		"node": "26.8.1",
		"xcode": "26.4.1"
	},
	"evidence": "https://github.com/NativeScript/compatibility/actions/runs/34347383414",
	"recordedAt": "2026-09-09T12:08:24.250Z"
}
