{
	"$schema": "https://compatibility.nativescript.org/v1/schemas/verified.json",
	"package": "@nativescript/android",
	"version": "9.0.4",
	"toolchains": {
		"compileSdk": "35",
		"buildTools": "35.0.1",
		"jdk": "21"
	},
	"with": {
		"nativescript": "9.1.2",
		"node": "24"
	},
	"resolved": {
		"node": "24.21.0",
		"jdk": "21.0.12.1"
	},
	"evidence": "https://github.com/NativeScript/compatibility/actions/runs/37312331164",
	"recordedAt": "2026-10-05T13:04:07.624Z"
}
